{
  "schemaVersion": "1.0.0",
  "meta": {
    "runId": "v7-M0-2026-08-14",
    "signalDate": "2026-08-14",
    "matcherVersion": "1.0.0",
    "rulesVersion": "1.0.0",
    "libraryVersion": "1.0.0",
    "equityCny": 100000,
    "marginRate": 0.08,
    "generatedAt": "2026-08-14T00:00:00.000Z",
    "inputsSha": "71ada576acbe6d63f6e5d0958a276547ddcfb8d1c1f8a0befdf176cfe4708853"
  },
  "plans": [
    {
      "symbol": "M0",
      "name": "豆粕",
      "contract": "M0",
      "rank": 1,
      "sector": "agriculture",
      "reportBaseline": {
        "direction": "bullish",
        "confidence": "low",
        "driver": "价格 3165 高于 m20 3135.1 与 m60 3031.2；板块 r5 +1.06、r20 +1.77、br 1.0 健康；宏观 US10Y +0.65 偏空、SC0 +4.67 偏多、DXY +0.04 中性；evt 仅未核实日历，nxt 为空。趋势仍在但动量不足。",
        "confirmSignals": [
          "BP-TREND:breakout@3165"
        ],
        "invalidationConditions": [
          "收盘跌破 m20 则多头趋势失效（Q5 结构位 3135.1）"
        ]
      },
      "matchedStrategies": [
        {
          "strategyId": "MS-07",
          "name": "板块动量轮动 / 广度确认",
          "score": 1.5,
          "matchEvidence": "ss.advanceRatio1d gte 50 → 实值=100；ss.sectorDirection eq reportDirection → 实值=up",
          "evidenceType": "deterministic"
        }
      ],
      "supportingEvidence": [
        {
          "strategyId": "MS-05",
          "name": "增长-通胀象限 regime 配置（All-Weather / 投资时钟）",
          "score": 1,
          "matchEvidence": "策略条件求值通过（用已有锚点把宏观状态近似映射到增长×通胀四象限，按象限偏好顺周期多头/供给受限多头/宏观空头/中性。）",
          "evidenceType": "deterministic"
        }
      ],
      "playbook": {
        "playbookId": "PB-03",
        "gateStatus": "pass",
        "gateNote": "MA20/MA60 对齐",
        "executionConvention": "T+1 开盘；跳空 >0.75×ATR5 放弃；多头回踩要求持仓不塌（报告既有表述）"
      },
      "entry": {
        "trigger": "↑ 多：BP-TREND:breakout@3165",
        "triggerLevel": 3165,
        "triggerSource": "BP-TREND:breakout@3165",
        "triggerTiming": "T+1 开盘执行",
        "execution": "T+1 开盘；跳空 >0.75×ATR5 放弃"
      },
      "stop": {
        "stopPrice": 3118.8,
        "stopDistancePts": 46.2,
        "basis": "min(stopK×ATR5, 0.8×limitPct×close, |Q5 结构位−close|)"
      },
      "targets": {
        "t1": "前高/前低 或 3d p68 沿（先到者，平 50%）",
        "t2": "2R–3R（余仓 1×ATR5 移动止损）",
        "basis": "R 口径"
      },
      "position": {
        "lots": 0,
        "lotsBasis": "min(风险预算 0 手, 波动率目标 1 手, 保证金 13 手)"
      },
      "riskAssessment": {
        "riskPerTradePct": 0.01,
        "confidenceScale": 0,
        "stopK": 1.5,
        "stopDistancePts": 46.2,
        "stopPrice": 3118.8,
        "structuralStop": null,
        "unitRiskCny": 462,
        "lots": 0,
        "marginPerLotCny": 2532,
        "marginUtilizationPct": 0,
        "volContributionPctAnnual": 0,
        "tailGapPct3d": -2.99,
        "stressRiskCny": 0,
        "eventRiskNote": "—",
        "maxHoldingDays": 5
      },
      "executionStatus": "watch",
      "statusReasons": [
        "报告置信度为 low：只观察不持仓"
      ],
      "invalidation": {
        "hard": [
          "收盘跌破 m20 则多头趋势失效（Q5 结构位 3135.1）"
        ],
        "timeStop": "T+5 无确认无失效则市价退出",
        "supersededByNextRun": true
      },
      "notes": [],
      "disclaimer": "⚠️ 免责声明：本板块策略为分析工具输出，仅为方向增强与执行参考，不构成投资建议，不执行真实交易。所有参数（手数/止损/目标）均为按示例权益的确定性风险计算演示，不含任何收益承诺或预期收益；历史文献与样本内回测结论不代表未来表现。保证金与涨跌停以交易所当日公告为准。报告结论（方向/置信度）是第一依据，本板块不得反向修改。"
    }
  ],
  "concentrationDecisions": [],
  "provenance": {
    "source": "output/runs/v7-M0-2026-08-14/{report-model,probability,sector-snapshot,sector-driver,macro-snapshot,analysis,raw}.json + config/symbols.json",
    "generator": "futures-radar/strategies/lib/strategy-matcher.cjs",
    "discipline": [
      "无新增持仓(OI)数据依赖：Q4/Q5 既有持仓表述仅文本引用（未读取 ohlcv.openInterest/derived.avgOI5d）",
      "无前视：只使用信号日 T 及之前的已冻结值",
      "无收益承诺：不输出任何收益/胜率数字",
      "不修改报告方向与置信度"
    ]
  },
  "disclaimer": "⚠️ 免责声明：本板块策略为分析工具输出，仅为方向增强与执行参考，不构成投资建议，不执行真实交易。所有参数（手数/止损/目标）均为按示例权益的确定性风险计算演示，不含任何收益承诺或预期收益；历史文献与样本内回测结论不代表未来表现。保证金与涨跌停以交易所当日公告为准。报告结论（方向/置信度）是第一依据，本板块不得反向修改。"
}