{
  "schemaVersion": "1.0.0",
  "meta": {
    "runId": "v7-M0-2026-07-31",
    "signalDate": "2026-07-31",
    "matcherVersion": "1.0.0",
    "rulesVersion": "1.0.0",
    "libraryVersion": "1.0.0",
    "equityCny": 100000,
    "marginRate": 0.08,
    "generatedAt": "2026-07-31T00:00:00.000Z",
    "inputsSha": "29d39da9005e24133c7082ed260842f60733fc4b0dde708fde25662d4feed4ce"
  },
  "plans": [
    {
      "symbol": "M0",
      "name": "豆粕",
      "contract": "M0",
      "rank": 1,
      "sector": "agriculture",
      "reportBaseline": {
        "direction": "bearish",
        "confidence": "medium",
        "driver": "价格 3071 跌破 m20 3092.9；板块 r5 -2.15、r20 -2.28、br 0、co 0.88 一致转空；宏观冲突：DXY -1.65 偏多，US10Y +1.28、SC0 -7.35 偏空；evt.fomc、evt.china_pmi 已落地，nxt 为空。板块驱动偏空。",
        "confirmSignals": [
          "BP-BREAK:breakout@3071"
        ],
        "invalidationConditions": [
          "收盘收复 m20 则空头破位失效"
        ]
      },
      "matchedStrategies": [
        {
          "strategyId": "MS-02",
          "name": "风险偏好 regime 轮动（Risk-On / Risk-Off）",
          "score": 2.25,
          "matchEvidence": "riskOff=3 ≥3（stale 锚点: 无）；driver 命中宏观关键词",
          "evidenceType": "deterministic"
        }
      ],
      "supportingEvidence": [
        {
          "strategyId": "MS-05",
          "name": "增长-通胀象限 regime 配置（All-Weather / 投资时钟）",
          "score": 1,
          "matchEvidence": "策略条件求值通过（用已有锚点把宏观状态近似映射到增长×通胀四象限，按象限偏好顺周期多头/供给受限多头/宏观空头/中性。）",
          "evidenceType": "deterministic"
        }
      ],
      "playbook": {
        "playbookId": "PB-08",
        "gateStatus": "pending",
        "gateNote": "divergencePct=0<20；价格未触及 3d p68 上沿（—）±0.25×ATR5 → 触发 pending",
        "executionConvention": "T+1 开盘；跳空 >0.5×ATR5 放弃；空头距涨停 <1×ATR5 禁开（Q6 口径）"
      },
      "entry": {
        "trigger": "↓ 空：BP-BREAK:breakout@3071",
        "triggerLevel": 3071,
        "triggerSource": "BP-BREAK:breakout@3071",
        "triggerTiming": "T+1 开盘执行",
        "execution": "T+1 开盘；跳空 >0.5×ATR5 放弃"
      },
      "stop": {
        "stopPrice": 3141.5,
        "stopDistancePts": 70.5,
        "basis": "min(stopK×ATR5, 0.8×limitPct×close, |Q5 结构位−close|)"
      },
      "targets": {
        "t1": "3d p68 下沿 —（平 50%）",
        "t2": "3d p95 下沿 —",
        "basis": "概率锥区间"
      },
      "position": {
        "lots": 1,
        "lotsBasis": "min(风险预算 1 手, 波动率目标 1 手, 保证金 13 手)"
      },
      "riskAssessment": {
        "riskPerTradePct": 0.01,
        "confidenceScale": 0.75,
        "stopK": 1.5,
        "stopDistancePts": 70.5,
        "stopPrice": 3141.5,
        "structuralStop": null,
        "unitRiskCny": 705,
        "lots": 1,
        "marginPerLotCny": 2457,
        "marginUtilizationPct": 2.46,
        "volContributionPctAnnual": 6.14,
        "tailGapPct3d": -2.3,
        "stressRiskCny": 1228,
        "eventRiskNote": "—",
        "maxHoldingDays": 5
      },
      "executionStatus": "executable",
      "statusReasons": [
        "全部 hard 校验与警示规则通过"
      ],
      "invalidation": {
        "hard": [
          "收盘收复 m20 则空头破位失效"
        ],
        "timeStop": "T+5 无确认无失效则市价退出",
        "supersededByNextRun": true
      },
      "notes": [],
      "disclaimer": "⚠️ 免责声明：本板块策略为分析工具输出，仅为方向增强与执行参考，不构成投资建议，不执行真实交易。所有参数（手数/止损/目标）均为按示例权益的确定性风险计算演示，不含任何收益承诺或预期收益；历史文献与样本内回测结论不代表未来表现。保证金与涨跌停以交易所当日公告为准。报告结论（方向/置信度）是第一依据，本板块不得反向修改。"
    }
  ],
  "concentrationDecisions": [],
  "provenance": {
    "source": "output/runs/v7-M0-2026-07-31/{report-model,probability,sector-snapshot,sector-driver,macro-snapshot,analysis,raw}.json + config/symbols.json",
    "generator": "futures-radar/strategies/lib/strategy-matcher.cjs",
    "discipline": [
      "无新增持仓(OI)数据依赖：Q4/Q5 既有持仓表述仅文本引用（未读取 ohlcv.openInterest/derived.avgOI5d）",
      "无前视：只使用信号日 T 及之前的已冻结值",
      "无收益承诺：不输出任何收益/胜率数字",
      "不修改报告方向与置信度"
    ]
  },
  "disclaimer": "⚠️ 免责声明：本板块策略为分析工具输出，仅为方向增强与执行参考，不构成投资建议，不执行真实交易。所有参数（手数/止损/目标）均为按示例权益的确定性风险计算演示，不含任何收益承诺或预期收益；历史文献与样本内回测结论不代表未来表现。保证金与涨跌停以交易所当日公告为准。报告结论（方向/置信度）是第一依据，本板块不得反向修改。"
}