{
  "schemaVersion": "1.0.0",
  "meta": {
    "runId": "v7-RB0-2026-06-26",
    "signalDate": "2026-06-26",
    "matcherVersion": "1.0.0",
    "rulesVersion": "1.0.0",
    "libraryVersion": "1.0.0",
    "equityCny": 100000,
    "marginRate": 0.08,
    "generatedAt": "2026-06-26T00:00:00.000Z",
    "inputsSha": "93cfff030d02d712de14723de57f1cd6e1882d42443f71561f0e36fdd8b842f0"
  },
  "plans": [
    {
      "symbol": "RB0",
      "name": "螺纹钢",
      "contract": "RB0",
      "rank": 1,
      "sector": "black",
      "reportBaseline": {
        "direction": "bearish",
        "confidence": "medium",
        "driver": "（继承 2026-06-18）",
        "confirmSignals": [
          "BP-SHOCK:pullback@3150.8"
        ],
        "invalidationConditions": [
          "（继承，按当前 m20 重投影）"
        ]
      },
      "matchedStrategies": [
        {
          "strategyId": "BASE-01",
          "name": "报告结论跟随（Q1+Q4+Q5 框架基线）",
          "score": 0,
          "matchEvidence": "无策略命中，按报告 Q1（驱动）+Q4（确认）+Q5（失效）框架基线适配",
          "evidenceType": "deterministic"
        }
      ],
      "supportingEvidence": [
        {
          "strategyId": "MS-05",
          "name": "增长-通胀象限 regime 配置（All-Weather / 投资时钟）",
          "score": 1,
          "matchEvidence": "策略条件求值通过（用已有锚点把宏观状态近似映射到增长×通胀四象限，按象限偏好顺周期多头/供给受限多头/宏观空头/中性。）",
          "evidenceType": "deterministic"
        }
      ],
      "playbook": {
        "playbookId": "PB-03",
        "gateStatus": "pass",
        "gateNote": "MA20/MA60 对齐",
        "executionConvention": "T+1 开盘；跳空 >0.75×ATR5 放弃；空头反抽要求持仓不增（报告既有表述）"
      },
      "entry": {
        "trigger": "↓ 空：BP-SHOCK:pullback@3150.8",
        "triggerLevel": 3150.8,
        "triggerSource": "BP-SHOCK:pullback@3150.8",
        "triggerTiming": "T+1 开盘执行",
        "execution": "T+1 开盘；跳空 >0.75×ATR5 放弃"
      },
      "stop": {
        "stopPrice": 3129,
        "stopDistancePts": 36,
        "basis": "min(stopK×ATR5, 0.8×limitPct×close, |Q5 结构位−close|)"
      },
      "targets": {
        "t1": "前高/前低 或 3d p68 沿（先到者，平 50%）",
        "t2": "2R–3R（余仓 1×ATR5 移动止损）",
        "basis": "R 口径"
      },
      "position": {
        "lots": 1,
        "lotsBasis": "min(风险预算 2 手, 波动率目标 1 手, 保证金 13 手)"
      },
      "riskAssessment": {
        "riskPerTradePct": 0.01,
        "confidenceScale": 0.75,
        "stopK": 1.5,
        "stopDistancePts": 36,
        "stopPrice": 3129,
        "structuralStop": null,
        "unitRiskCny": 360,
        "lots": 1,
        "marginPerLotCny": 2474,
        "marginUtilizationPct": 2.47,
        "volContributionPctAnnual": 6.19,
        "tailGapPct3d": -1.16,
        "stressRiskCny": 1237,
        "eventRiskNote": "—",
        "maxHoldingDays": 5
      },
      "executionStatus": "executable",
      "statusReasons": [
        "全部 hard 校验与警示规则通过"
      ],
      "invalidation": {
        "hard": [
          "（继承，按当前 m20 重投影）"
        ],
        "timeStop": "T+5 无确认无失效则市价退出",
        "supersededByNextRun": true
      },
      "notes": [],
      "disclaimer": "⚠️ 免责声明：本板块策略为分析工具输出，仅为方向增强与执行参考，不构成投资建议，不执行真实交易。所有参数（手数/止损/目标）均为按示例权益的确定性风险计算演示，不含任何收益承诺或预期收益；历史文献与样本内回测结论不代表未来表现。保证金与涨跌停以交易所当日公告为准。报告结论（方向/置信度）是第一依据，本板块不得反向修改。"
    }
  ],
  "concentrationDecisions": [],
  "provenance": {
    "source": "output/runs/v7-RB0-2026-06-26/{report-model,probability,sector-snapshot,sector-driver,macro-snapshot,analysis,raw}.json + config/symbols.json",
    "generator": "futures-radar/strategies/lib/strategy-matcher.cjs",
    "discipline": [
      "无新增持仓(OI)数据依赖：Q4/Q5 既有持仓表述仅文本引用（未读取 ohlcv.openInterest/derived.avgOI5d）",
      "无前视：只使用信号日 T 及之前的已冻结值",
      "无收益承诺：不输出任何收益/胜率数字",
      "不修改报告方向与置信度"
    ]
  },
  "disclaimer": "⚠️ 免责声明：本板块策略为分析工具输出，仅为方向增强与执行参考，不构成投资建议，不执行真实交易。所有参数（手数/止损/目标）均为按示例权益的确定性风险计算演示，不含任何收益承诺或预期收益；历史文献与样本内回测结论不代表未来表现。保证金与涨跌停以交易所当日公告为准。报告结论（方向/置信度）是第一依据，本板块不得反向修改。"
}