{
  "schemaVersion": "1.0.0",
  "meta": {
    "runId": "v7-SC0-2026-07-31",
    "signalDate": "2026-07-31",
    "matcherVersion": "1.0.0",
    "rulesVersion": "1.0.0",
    "libraryVersion": "1.0.0",
    "equityCny": 100000,
    "marginRate": 0.08,
    "generatedAt": "2026-07-31T00:00:00.000Z",
    "inputsSha": "59c7f9486b86ddcba391e9b071785155fbad253e6f2a28d3070b1705bf83cc5d"
  },
  "plans": [
    {
      "symbol": "SC0",
      "name": "原油",
      "contract": "SC0",
      "rank": 1,
      "sector": "energy_chemical",
      "reportBaseline": {
        "direction": "bullish",
        "confidence": "medium",
        "driver": "上涨趋势中的回撤：sect.r20 仍正，但 sect.r5 转负、macro.US10Y 与 macro.DR007 收紧形成压力，等待回踩确认。",
        "confirmSignals": [
          "BP-PULL:pullback@518.8"
        ],
        "invalidationConditions": [
          "MA20（约518.8）收盘跌破 p.SC0.m20 下方则多头失效"
        ]
      },
      "matchedStrategies": [
        {
          "strategyId": "BASE-01",
          "name": "报告结论跟随（Q1+Q4+Q5 框架基线）",
          "score": 0,
          "matchEvidence": "无策略命中，按报告 Q1（驱动）+Q4（确认）+Q5（失效）框架基线适配",
          "evidenceType": "deterministic"
        }
      ],
      "supportingEvidence": [
        {
          "strategyId": "MS-05",
          "name": "增长-通胀象限 regime 配置（All-Weather / 投资时钟）",
          "score": 1,
          "matchEvidence": "策略条件求值通过（用已有锚点把宏观状态近似映射到增长×通胀四象限，按象限偏好顺周期多头/供给受限多头/宏观空头/中性。）",
          "evidenceType": "deterministic"
        }
      ],
      "playbook": {
        "playbookId": "PB-08",
        "gateStatus": "pending",
        "gateNote": "divergencePct=0<20；价格未触及 3d p68 下沿（517.1）±0.25×ATR5 → 触发 pending；PB-08 放弃条款：锥形止损距离 63.4 > 1.5×T1 预期（45.9）→ 当日放弃，转执行触发=Q4 确认信号",
        "executionConvention": "T+1 开盘；跳空 >0.5×ATR5 放弃；多头距跌停 <1×ATR5 禁开（Q6 口径）"
      },
      "entry": {
        "trigger": "↑ 多：BP-PULL:pullback@518.8",
        "triggerLevel": 518.8,
        "triggerSource": "BP-PULL:pullback@518.8",
        "triggerTiming": "T+1 开盘执行",
        "execution": "T+1 开盘；跳空 >0.5×ATR5 放弃"
      },
      "stop": {
        "stopPrice": 528.62,
        "stopDistancePts": 17.48,
        "basis": "min(stopK×ATR5, 0.8×limitPct×close, |Q5 结构位−close|)；止损受 0.8×涨跌停幅度约束"
      },
      "targets": {
        "t1": "3d p68 上沿 576.7（平 50%）",
        "t2": "3d p95 上沿 607.7",
        "basis": "概率锥区间"
      },
      "position": {
        "lots": 0,
        "lotsBasis": "min(风险预算 0 手, 波动率目标 0 手, 保证金 0 手)"
      },
      "riskAssessment": {
        "riskPerTradePct": 0.01,
        "confidenceScale": 0.75,
        "stopK": 1.5,
        "stopDistancePts": 17.48,
        "stopPrice": 528.62,
        "structuralStop": 518.8,
        "unitRiskCny": 17475.2,
        "lots": 0,
        "marginPerLotCny": 43688,
        "marginUtilizationPct": 0,
        "volContributionPctAnnual": 0,
        "tailGapPct3d": -10.13,
        "stressRiskCny": 0,
        "eventRiskNote": "—",
        "maxHoldingDays": 5
      },
      "executionStatus": "watch",
      "statusReasons": [
        "风险预算不足（medium 约需 233 万权益才到 1 手）",
        "尾部 3d p95 反向 -10.1% ≥ 涨跌停 4%（连续停板警示）",
        "PB-08 放弃条款：锥形止损距离 63.4 > 1.5×T1 预期（45.9）→ 当日放弃，转执行触发=Q4 确认信号"
      ],
      "invalidation": {
        "hard": [
          "MA20（约518.8）收盘跌破 p.SC0.m20 下方则多头失效"
        ],
        "timeStop": "T+5 无确认无失效则市价退出",
        "supersededByNextRun": true
      },
      "notes": [
        "止损受 0.8×涨跌停幅度约束"
      ],
      "disclaimer": "⚠️ 免责声明：本板块策略为分析工具输出，仅为方向增强与执行参考，不构成投资建议，不执行真实交易。所有参数（手数/止损/目标）均为按示例权益的确定性风险计算演示，不含任何收益承诺或预期收益；历史文献与样本内回测结论不代表未来表现。保证金与涨跌停以交易所当日公告为准。报告结论（方向/置信度）是第一依据，本板块不得反向修改。"
    }
  ],
  "concentrationDecisions": [],
  "provenance": {
    "source": "output/runs/v7-SC0-2026-07-31/{report-model,probability,sector-snapshot,sector-driver,macro-snapshot,analysis,raw}.json + config/symbols.json",
    "generator": "futures-radar/strategies/lib/strategy-matcher.cjs",
    "discipline": [
      "无新增持仓(OI)数据依赖：Q4/Q5 既有持仓表述仅文本引用（未读取 ohlcv.openInterest/derived.avgOI5d）",
      "无前视：只使用信号日 T 及之前的已冻结值",
      "无收益承诺：不输出任何收益/胜率数字",
      "不修改报告方向与置信度"
    ]
  },
  "disclaimer": "⚠️ 免责声明：本板块策略为分析工具输出，仅为方向增强与执行参考，不构成投资建议，不执行真实交易。所有参数（手数/止损/目标）均为按示例权益的确定性风险计算演示，不含任何收益承诺或预期收益；历史文献与样本内回测结论不代表未来表现。保证金与涨跌停以交易所当日公告为准。报告结论（方向/置信度）是第一依据，本板块不得反向修改。"
}