{
  "schemaVersion": "1.0.0",
  "meta": {
    "runId": "v7-RB0-2026-06-11",
    "signalDate": "2026-06-11",
    "matcherVersion": "1.0.0",
    "rulesVersion": "1.0.0",
    "libraryVersion": "1.0.0",
    "equityCny": 100000,
    "marginRate": 0.08,
    "generatedAt": "2026-06-11T00:00:00.000Z",
    "inputsSha": "ecaa608f4e2fb5cc5e8562e2dfb1612a896d50bed2f311c501ffb9e552f759cf"
  },
  "plans": [
    {
      "symbol": "RB0",
      "name": "螺纹钢",
      "contract": "RB0",
      "rank": 1,
      "sector": "black",
      "reportBaseline": {
        "direction": "bearish",
        "confidence": "low",
        "driver": "资金面与能源端边际转弱（macro.DR007、macro.SC0），叠加黑色板块短周期走弱（sect.r5），构成偏空驱动；但价格动量未明显放大。",
        "confirmSignals": [
          "BP-TREND:pullback@3174.1"
        ],
        "invalidationConditions": [
          "收盘站回 m20 上方则空头结构失效。（Q5 结构位 3174.1）"
        ]
      },
      "matchedStrategies": [
        {
          "strategyId": "BASE-01",
          "name": "报告结论跟随（Q1+Q4+Q5 框架基线）",
          "score": 0,
          "matchEvidence": "无策略命中，按报告 Q1（驱动）+Q4（确认）+Q5（失效）框架基线适配",
          "evidenceType": "deterministic"
        }
      ],
      "supportingEvidence": [
        {
          "strategyId": "MS-05",
          "name": "增长-通胀象限 regime 配置（All-Weather / 投资时钟）",
          "score": 1,
          "matchEvidence": "策略条件求值通过（用已有锚点把宏观状态近似映射到增长×通胀四象限，按象限偏好顺周期多头/供给受限多头/宏观空头/中性。）",
          "evidenceType": "deterministic"
        }
      ],
      "playbook": {
        "playbookId": "PB-08",
        "gateStatus": "pending",
        "gateNote": "divergencePct=0<20；价格未触及 3d p68 上沿（3191.8）±0.25×ATR5 → 触发 pending；PB-08 放弃条款：锥形止损距离 77.8 > 1.5×T1 预期（53.1）→ 当日放弃，转执行触发=Q4 确认信号",
        "executionConvention": "T+1 开盘；跳空 >0.5×ATR5 放弃；空头距涨停 <1×ATR5 禁开（Q6 口径）"
      },
      "entry": {
        "trigger": "↓ 空：BP-TREND:pullback@3174.1",
        "triggerLevel": 3174.1,
        "triggerSource": "BP-TREND:pullback@3174.1",
        "triggerTiming": "T+1 开盘执行",
        "execution": "T+1 开盘；跳空 >0.5×ATR5 放弃"
      },
      "stop": {
        "stopPrice": 3199.8,
        "stopDistancePts": 43.8,
        "basis": "min(stopK×ATR5, 0.8×limitPct×close, |Q5 结构位−close|)"
      },
      "targets": {
        "t1": "3d p68 下沿 3120.6（平 50%）",
        "t2": "3d p95 下沿 3087.0",
        "basis": "概率锥区间"
      },
      "position": {
        "lots": 0,
        "lotsBasis": "min(风险预算 0 手, 波动率目标 1 手, 保证金 13 手)"
      },
      "riskAssessment": {
        "riskPerTradePct": 0.01,
        "confidenceScale": 0,
        "stopK": 1.5,
        "stopDistancePts": 43.8,
        "stopPrice": 3199.8,
        "structuralStop": null,
        "unitRiskCny": 438,
        "lots": 0,
        "marginPerLotCny": 2525,
        "marginUtilizationPct": 0,
        "volContributionPctAnnual": 0,
        "tailGapPct3d": -2.19,
        "stressRiskCny": 0,
        "eventRiskNote": "—",
        "maxHoldingDays": 5
      },
      "executionStatus": "watch",
      "statusReasons": [
        "报告置信度为 low：只观察不持仓",
        "PB-08 放弃条款：锥形止损距离 77.8 > 1.5×T1 预期（53.1）→ 当日放弃，转执行触发=Q4 确认信号"
      ],
      "invalidation": {
        "hard": [
          "收盘站回 m20 上方则空头结构失效。（Q5 结构位 3174.1）"
        ],
        "timeStop": "T+5 无确认无失效则市价退出",
        "supersededByNextRun": true
      },
      "notes": [],
      "disclaimer": "⚠️ 免责声明：本板块策略为分析工具输出，仅为方向增强与执行参考，不构成投资建议，不执行真实交易。所有参数（手数/止损/目标）均为按示例权益的确定性风险计算演示，不含任何收益承诺或预期收益；历史文献与样本内回测结论不代表未来表现。保证金与涨跌停以交易所当日公告为准。报告结论（方向/置信度）是第一依据，本板块不得反向修改。"
    }
  ],
  "concentrationDecisions": [],
  "provenance": {
    "source": "output/runs/v7-RB0-2026-06-11/{report-model,probability,sector-snapshot,sector-driver,macro-snapshot,analysis,raw}.json + config/symbols.json",
    "generator": "futures-radar/strategies/lib/strategy-matcher.cjs",
    "discipline": [
      "无新增持仓(OI)数据依赖：Q4/Q5 既有持仓表述仅文本引用（未读取 ohlcv.openInterest/derived.avgOI5d）",
      "无前视：只使用信号日 T 及之前的已冻结值",
      "无收益承诺：不输出任何收益/胜率数字",
      "不修改报告方向与置信度"
    ]
  },
  "disclaimer": "⚠️ 免责声明：本板块策略为分析工具输出，仅为方向增强与执行参考，不构成投资建议，不执行真实交易。所有参数（手数/止损/目标）均为按示例权益的确定性风险计算演示，不含任何收益承诺或预期收益；历史文献与样本内回测结论不代表未来表现。保证金与涨跌停以交易所当日公告为准。报告结论（方向/置信度）是第一依据，本板块不得反向修改。"
}